Type,id,Citation,Elements,Authors,Year
Electronic,La75,J.J.Lapikas: (Ref. [8] in DV75) ,"................................................................. Cr, Fe",J.J.Lapikas,
Electronic,Oy75,"M.Oyamada, et al.: Phys. Rev. C11 (1975) 1578 ",.................................... F,"M.Oyamada,etal.",1975
Electronic,Sc75,"W.Sch0tz: Z. Physik, A273 (1975) 69 ","...................................................... N, 0",W.Sch0tz,1975
Electronic,Si75,"I.Sick, et al.: Phys. Rev. Lett. 35 (1975) 910 ",........................................... Ni,"I.Sick,etal.",1975
Electronic,Vr75,"C. deVries: Rencontres de Saclay, 12-16 mai, 8-12 sept. 1975, p.485 ","... Ti, Cr, Fe, Nd",C.deVries,1975
Electronic,Co76,"T.Cooper, et al.: Phys. Rev. C13 (1976) 1083 ","......................................... Sm, Er, Yb, Th, U","T.Cooper,etal.",1976
Electronic,Eu76,"H.Euteneuer, J.Friedrich, N.Voegler: Phys. Rev. Lett. 36(1976)129 ","....... Pb, Tl","H.Euteneuer,J.Friedrich,N.Voegler",1976
Electronic,Fi76,"J.M.Finn, et al.: Nucl. Phys. A274 (1976) 28 ",........................................... Ar,"J.M.Finn,etal.",1976
Electronic,Ja76,"E.Jans: MS thesis, Univ. Amsterdam (1976), unpublished ","...................... Nb, Mo, Pd, In",E.Jans,1976
Electronic,Ko76,"L.Koester, W.Nistler, W.Waschkowski: Phys. Rev. Lett. 36(1976)1021 ",.. neutron,"L.Koester,W.Nistler,W.Waschkowski",1976
Electronic,La76,"J.J.Lapikas: MS thesis, Univ. Amsterdam (1976), unpublished ",".............. Cr, Fe",J.J.Lapikas,1976
Electronic,Le76,"E.W.Lees, et al.: J. Phys. G.: Nucl. Phys. 2 (1976) 105 ",.......................... Mg,"E.W.Lees,etal.",1976
Electronic,Li76,"J.W.Lightbody, et al.: Phys. Rev. C14 (1976) 952 ","................................... Cr, Pd, Cd, Sn","J.W.Lightbody,etal.",1976
Electronic,Me76,"K.Merle: Ph.D. thesis, Univ. Mainz (1976) unpublished (from Vr87) ","....... P, S",K.Merle,1976
Electronic,Ro76,"H.Rothhaas: Ph.D. thesis, Univ. Mainz (1976) unpubl. (from Vr87) ",........ Zr,H.Rothhaas,1976
Electronic,Si76,"I.Sick, J.S.McCarthy, RR.Whitney: Phys. Letters, 648(1976)33 ",............ He,"I.Sick,J.S.McCarthy,RR.Whitney",1976
Electronic,St76,"G.Stephan: Ph.D. thesis, Univ. Mainz (1976) unpubl. (from Vr87) ",.......... Sr,G.Stephan,1976
Electronic,Wo76,"H.D.Wohlfahrt: Habilitationschrift, Univ. Mainz (1976) unp. (from Ja79) ",". Fe, Ni, Zn",H.D.Wohlfahrt,1976
Electronic,An77,"D.A.Andrews, R.Golub, G.Newton: J. Phys. G: 3(1977)L91 ",.................... H,"D.A.Andrews,R.Golub,G.Newton",1977
Electronic,Br77,"S.W.Brain, etal.: J. Phys. G.: Nucl. Phys. 3 (1977) 821 ",......................... Si,"S.W.Brain,etal.",1977
Electronic,Cr77,"C.W.Creswell: Ph.D. thesis, Mass. Inst. Techn., unpubl. (from Vr87) ","..... Er, Yb, U",C.W.Creswell,
Electronic,Eu77a,"H.Euteneuer, et al.: Phys. Rev. C16 (1977) 1703 ",.................................... Mg,"H.Euteneuer,etal.",1977
Electronic,Fr77a,"B.Frois, et al.: Phys. Rev. Lett. 38 (1977) 152 ",......................................... Pb,"B.Frois,etal.",1977
Electronic,Fr77b,"J.L.Friar, et al.: Proc. Workshop lnterm. En. Electrom. Interact. ed. AM.Bernstein, Mass. Inst. Techn. (1977) p. 325 ",............. Pb,"J.L.Friar,etal.",1977
Electronic,Hi77,"AS.Hirsch, Ph.D. thesis, Mass. Inst. Techn. (1977) unpubl. (from Vr87)"," Nd, Gd, Th","AS.Hirsch,Ph.D.thesis,Mass.Inst.Techn.(1977)unpubl.(fromVr87)",1977
Electronic,Ke77,"M.Kegel: MS thesis, Univ. Amsterdam (1977) unpublished ",".................... Ni, Cu, Zn",M.Kegel,1977
Electronic,MC77,"J.S.McCarthy, I.Sick, RR.Whitney: Phys. Rev. C15 (1977) 1396 ",........... He,"J.S.McCarthy,I.Sick,RR.Whitney",1977
Electronic,Na77,"A.Nakada, et al.: Phys. Rev. Lett. 38 (1977) 584 ",..................................... Sm,"A.Nakada,etal.",1977
Electronic,Sz77,"Z.M.Szalata, et al.: Phys. Rev. C15 (1977) 1200 ",.................................... He,"Z.M.Szalata,etal.",1977
Electronic,Ak78,"Yu.K.Akimov, et al.: Preprint EFl-326(5I)-78 (1978) ",................................ H,"Yu.K.Akimov,etal.",1978
Electronic,Ar78,"R.G.Arnold, et al.: Phys. Rev. Lett. 40 (1978) 1429 ",................................ He,"R.G.Arnold,etal.",1978
Electronic,Ca78,"L.S.Cardman, et al.: Phys. Rev. C18 (1978) 1388 ",................................... Er,"L.S.Cardman,etal.",1978
Electronic,Eu78,"H.Euteneuer, J.Friedrich, N.Voegler: Nucl. Phys. A298 (1978) 452 ","....... Tl, Pb, Bi","H.Euteneuer,J.Friedrich,N.Voegler",1978
Electronic,Ki78,"J.C.Kim, et al.: Nucl. Phys. A297 (1978) 301 ",.......................................... 0,"J.C.Kim,etal.",1978
Electronic,Sh78a,"N.G.Shevchenko, et al.: Yad. Fiz. 27 (1978) 293 ",".................................... Co, Ni, Cu","N.G.Shevchenko,etal.",1978
Electronic,Sh78b,"N.G.Shevchenko, et al.: Yad. Fiz. 28 (1978) 276 ",".................................... Cr, Fe","N.G.Shevchenko,etal.",1978
Electronic,Sh78c,"N.G.Shevchenko, et al.: Yad. Fiz. 28 (1978) 577 ",".................................... Ti, Cr","N.G.Shevchenko,etal.",1978
Electronic,8a79,"A.V.Batyunin, et al.: lzv. Ak. Nauk SSSR, Ser. Fiz. 43(1979)2353 ",......... C,"A.V.Batyunin,etal.",1979
Electronic,Do79,"B.Dolbilkin: Contr.2.2 Int. Conf. Nucl. Phys. Mainz, June 5-9 (1979) ",...... C,B.Dolbilkin,1979
Electronic,Ho79,"R.Hofrnan, et al.: Jahresbericht 1978-79, Mainz, p. 170 ",.......................... Sm,"R.Hofrnan,etal.",1978
Electronic,Sa79,"T.Sasanuma: Ph.D. thesis, Mass. Inst. Techn. (1979) unp. (from Vr87) ",". Yb, Lu",T.Sasanuma,1979
Electronic,Sc79,"a.Schwentker: Contr.2. 7 Int. Conf. Nucl. Phys. Mainz, June 5-9 (1979) ",". Co, Cu",a.Schwentker,1979
Electronic,Si79,"I.Sick, et al.: Phys. Letters, 888 (1979) 245 ",............................................ Ca,"I.Sick,etal.",1979
Electronic,Sp79,"D.W.L.Sprung, et al.: Nucl. Phys. A325 (1979) 125 ",................................ Ni,"D.W.L.Sprung,etal.",1979
Electronic,8r80,"W.J.Briscoe, Hall Crannell, J.C.Bergstrom: Nucl. Phys. A344(1980)475 ", Cl,"W.J.Briscoe,HallCrannell,J.C.Bergstrom",1980
Electronic,Ca80a,"L.S.Cardman, et al.: Phys. Letters, 918 (1980) 203 ",................................ C,"L.S.Cardman,etal.",1980
Electronic,Ca80b,"J.M.Cavedon: Ph.D. thesis, Univ. Paris-Sud, (1980) unp. (from Vr87) ",... Ni,J.M.Cavedon,1980
Electronic,Si80,"G.G.Simon, et al.: Nucl. Phys. A333 (1980)381 ","...................................... C, H","G.G.Simon,etal.",1980
Electronic,Si80a,I.Sick: (Ref. [11) of Ba80(mu)) ,................................................................. O,I.Sick,
Electronic,Wo80,"H.D.Wohlfahrt, et al.: Phys. Rev. C22 (1980) 264 ","................................... Fe, Ni, Zn","H.D.Wohlfahrt,etal.",1980
Electronic,Oo81,"B.S.Dolbilkin, et al.: lzv. Akad. Nauk SSSR, Ser. Fiz., 45 (1981) 188 ",..... Al,"B.S.Dolbilkin,etal.",1981
Electronic,Kn81,"EA.Knight, et al.: J. Phys. G.: Nuc/. Phys. 7 (1981) 1115 ",....................... Ne,"EA.Knight,etal.",1981
Electronic,Mo81,"M.A.Moinester, et al.: Phys. Rev. C24 (1981) 80 ",.................................... Sm,"M.A.Moinester,etal.",1981
Electronic,Si81,"G.G.Simon, Ch.Schmitt, V.H.Walther: Nucl. Phys. A364 (1981) 285 ",...... H,"G.G.Simon,Ch.Schmitt,V.H.Walther",1981
Electronic,Be82,"D.H.Beck, J.Asai, and D.M.Skopik: Phys. Rev. C25 (1982) 1152 ",........... H,"D.H.Beck,J.Asai,D.M.Skopik",1982
Electronic,Ca82a,"J.M.Cavedon, etal.: Phys. Lett. 118B (1982) 311 ",................................... Sn,"J.M.Cavedon,etal.",1982
Electronic,Gu82,"A.V.Gunten: Thesis, TH Darmstadt (1982) (Ref. 5. in Ot85) ",................... He,A.V.Gunten,1982
Electronic,He82,"F.W.Hersman: Ph.D. thesis, Univ. Mainz (1982) unpubl. (from Vr87) ",..... Gd,F.W.Hersman,1982
Electronic,La82,"G.Lahm: Ph.D. thesis, Univ. Mainz (1982) unpubl. (from Vr87) ",".............. N, 0",G.Lahm,1982
Electronic,Mi82,"H.Miessen: Ph.D. thesis, Univ. Mainz (1982) unpubl. (from Vr87) ",".......... Si, P",H.Miessen,1982
Electronic,Ot82,"C.R.Ottermann, et al.: Nuc/. Phys. A379 (1982) 396 ",............................... Ar,"C.R.Ottermann,etal.",1982
Electronic,Re82,"W.Reuter, et al.: Phys. Rev. C26 (1982) 806 ",........................................... C,"W.Reuter,etal.",1982
Electronic,Si82,"I.Sick: Phys. Letters, 1168 (1982) 212 ",".................................................... He, C",I.Sick,1168
Electronic,Be83,"G.Beuscher: Ph.D. thesis, Univ. Mainz (1983) unpubl. (from Vr87) ",........ Ni,G.Beuscher,1983
Electronic,Bo83,"W.T.A.Borghols: MS thesis, Univ. Amsterdam (1983) unp. (from Vr87) ",. Pt,W.T.A.Borghols,1983
Electronic,Do83,"B.S.Dolbilkin, etal.: Yad. Fiz. 37 (1983) 264 ",........................................... Al,"B.S.Dolbilkin,etal.",1983
Electronic,Du83,"P.C.Dunn, et al.: Phys. Rev. C27 (1983) 71 ",............................................ He,"P.C.Dunn,etal.",1983
Electronic,Em83,"H.J.Emrich, et al.: Nucl. Phys. A396 (1983) 401 ",..................................... Ca,"H.J.Emrich,etal.",1983
Electronic,Em83a,"H.J.Emrich, et al.: Jahresbericht Mainz, 1982-83 p. 46 ",........................... Ca,"H.J.Emrich,etal.",1982
Electronic,Fr83,"B.Frois, et al.: Nucl. Phys. A396 (1983) 409c ","......................................... Tl, Pb","B.Frois,etal.",1983
Electronic,Li83,"J.W.Lightbody, Jr., etal.: Phys. Rev. C27 (1983) 113 ",............................. Cr,"J.W.Lightbody,Jr.,etal.",1983
Electronic,Ma83,"G.Mallot, et al.: Jahresbericht, Univ. Mainz, 1982-83 p. 51 ",..................... Ge,"G.Mallot,etal.",1982
Electronic,M083,"M.M0ller, H.G.Andresen: Jahresbericht, Univ. Mainz, 1982-83 p.64 ",....... Gd,"M.M0ller,H.G.Andresen",1982
Electronic,Ry83a,"D.Rychel, etal.: Phys. Letters, 1308 (1983) 5 ",........................................ S,"D.Rychel,etal.",1308
Electronic,Be84,"D.H.Beck, etal.: Phys. Rev. C30 (1984) 1403 ",........................................ H,"D.H.Beck,etal.",1984
Electronic,Ma84,"G.K.Mallot: Ph.D. Thesis, Univ. Mainz (1984) unpubl. (from Vr87) ",.......... Ge,G.K.Mallot,1984
Electronic,Re84a,W.Reuter et al: Phys. Rev. C30{1984)1465; Phys. Lett. 1378(1984)32 ,. Os,W.Reuteretal,1984
Electronic,Re84b,"G.A.Retzlaff, and D.M.Skopik: Phys. Rev. C29 (1984) 1194 ",................... He,"G.A.Retzlaff,D.M.Skopik",1984
Electronic,Al85,"Yu.A.Aleksandrov, et al.: Zh. Eksp. Teor. Fiz. 89 (1985) 34 ",................... neutron,"Yu.A.Aleksandrov,etal.",1985
Electronic,Be85,"J.C.Bergstrom, R.Neuhausen, G.Lahm: to be publ. (from Vr87) ",............. Ne,"J.C.Bergstrom,R.Neuhausen,G.Lahm",
Electronic,Ju85,"F.-P.Juster, et al.: Phys. Rev. Lett. 55 (1985) 2261 ",................................. H,"F.-P.Juster,etal.",1985
Electronic,Kh85,"A.Khomich: Tez. dokl. XXXV. sov. Leningrad, 16-18 Apr. 1985 p.346 ",..... Se,A.Khomich,1985
Electronic,Ot85,"C.R.Ottermann, et al.: Nuc/. Phys. A436 (1985) 688 ",............................... He,"C.R.Ottermann,etal.",1985
Electronic,Al86,"Yu.A.Aleksandrov, etal.: Yad. Fiz. 44 (1986) 1384 ",................................. neutron,"Yu.A.Aleksandrov,etal.",1986
Electronic,0086,"B.Dolbilkin: Tez. dokl. XXXVI sov. Kharkov, 15-18 Apr. 1986 p.352 ",....... B,B.Dolbilkin,1986
Electronic,Kh86,"A.A.Khomich, et al.: lzv. Akad. Nauk. SSSR Ser. Fiz. 51 (1987)958 ",....... Se,"A.A.Khomich,etal.",1987
Electronic,Kh86a,"A.A.Khomich, etal.: Yad. Fiz. 43 (1986) 1351 ",......................................... Se,"A.A.Khomich,etal.",1986
Electronic,Ko86,"L.Koester, et al.: Physica, 1378 (1986) 282 ",........................................... neutron,"L.Koester,etal.",1378
Electronic,La86,J.B. van der Laan: Ph.D. th. U. Amsterdam (1986) unp. (from Vr87) ,...... Pd,J.B.vanderLaan,1986
Electronic,La86a,"J.Laksanaboonsong: Ph.D.th. Univ. Virginia, (1986) unp. (from Vr87) ",.... Hg,J.Laksanaboonsong,1986
Electronic,Pe86,"B.A.Peterson: Ph.D. Thesis, University of Wyoming, USA (1986) ",.......... W,B.A.Peterson,1986
Electronic,Ro86,H.Rothhaas: (from Vr87) ,.......................................................................... AI,H.Rothhaas,
Electronic,Se86,"VF.Sears: Physics Reports, 141 (1986) 281 ",......................................... neutron (review),VF.Sears,1986
Electronic,Kh87,"A.A. Khomich et al: lzv. Ak. Nauk SSSR, Ser. Fiz. 51 (1987) 958 ",........... Se,A.A.Khomichetal,1987
Electronic,Vr87,"H.deVries, C.W.deJager, C.deVries: At. D. Nuc/. D. T. 36 (1987) 495 ",.... Many: Compilation,"H.deVries,C.W.deJager,C.deVries",1987
Electronic,8088,"W.Boeglin, et al.: Nucl. Phys. A477 (1988) 399 ","...................................... Os, Pt","W.Boeglin,etal.",1988
Electronic,Kh88,"A.A.Khomich, et al.: Yad. Fiz. 47 (1988) 305 ",........................................... Se,"A.A.Khomich,etal.",1988
Electronic,Ko88,"L.Koester, et al.: Z. Phys. A329 (1988) 229 ",............................................. neutron,"L.Koester,etal.",1988
Electronic,Se88,"AM.Selig, et al.: Nuc/. Phys. A476 (1988) 413 ",....................................... Ti,"AM.Selig,etal.",1988
Electronic,Of88,"E.A.J.M.Offermann: Thesis, Univ. Amsterdam (1988) ",............................. C,E.A.J.M.Offermann,1988
Electronic,Vr88,"J.W.de Vries, et al.: Phys. Lett. 8205 (1988) 22 ",...................................... N,"J.W.deVries,etal.",8205
Electronic,So88,"R.Soundranayagam, et al.: Phys. Lett. 8212 (1988) 13 ",.......................... Mg,"R.Soundranayagam,etal.",8212
Electronic,8u89,"A.J.C.Burghardt: Ph.D. thesis, Univ. Amsterdam (1989) ",......................... Hg,A.J.C.Burghardt,1989
Electronic,Ma89,"P.Mazanek: Dip/. Th., Inst. f. Kemph. PKH 11/89, U. Mainz 1989 ",".......... Zr, Mo (re-anal)",P.Mazanek,1989
Electronic,Kh90,"A.A.Khomich, et al.: Yad. Fiz. 51 (1990) 27 ",............................................. Ge,"A.A.Khomich,etal.",1990
Electronic,Pl90,"Platchkov, et al.: Nucl. Phys., A510 (1990) 740 ",...................................... neutron,"Platchkov,etal.",1990
Electronic,Of91,"E.A.J.M.Offermann, et al.: Phys. Rev. C44 (1991) 1096 ",......................... C,"E.A.J.M.Offermann,etal.",1991
Electronic,Ki92,"W.Kim, et al.: Phys. Rev., C46 (1992) 1656 ",............................................ Sr,"W.Kim,etal.",1992
Electronic,Ko92,"S.Kopecky, et al.: KNP Wiesbaden, 1992, Abstr. 2.1.11 ",........................ neutron,"S.Kopecky,etal.",1992
Electronic,Ma92a,"P.Mazanek, Ph.D. Th. Inst. f. Kemph. PKH 5/92, U. Mainz 1992 ",........... Pb (re-anal),"P.Mazanek,Ph.D.Th.Inst.f.Kemph.PKH5/92,U.Mainz1992",1992
Electronic,We93,"J.Wesseling, et al.: (to be published, from Fr95) ",".................................... Si, P, S","J.Wesseling,etal.",
Electronic,Al94,Yu.A.Alexandrov: Phys Rev. C49 (1994) R2297 ,..................................... neutron,Yu.A.Alexandrov,1994
Electronic,Am94,"A.Amroun, et al.: Nucl. Phys. A579 (1994) 596 ","....................................... H, He","A.Amroun,etal.",1994
Electronic,Fr95,"G. Fricke, et al.: At. D. Nucl. D. T. 60 ( 1995) 177 ",..................................... Many: combined anal,"G.Fricke,etal.",1995
Electronic,Ko95,"S.Kopecky, et al.Phys. Rev. Letters, 74 (1995) 2427 ",............................ neutron,"S.Kopecky,etal.Phys.Rev.Letters,74(1995)2427",1995
Electronic,Ko95a,"L.Koester, et al.: Phys. Rev. C51 (1995) 3363 ",........................................ neutron,"L.Koester,etal.",1995
Electronic,Me96,"P.Mergell, et al.: Nucl. Phys, A596 (1996) 367 ","....................................... neutron, H","P.Mergell,etal.",1996
Electronic,Si96,"I.Sick, and D.Trautmann: Physics Letters 8375 (1996) 16 ",...................... D: re-anal of x-sects,"I.Sick,D.Trautmann",8375
Electronic,Fr97,"G.Fricke, private communication ",............................................................. Sn: combined analysis,"G.Fricke,privatecommunication",
Electronic,Ko97,"S.Kopecky, et al.Phys. Rev. C56 (1997) 2229 ",...................................... neutron,"S.Kopecky,etal.Phys.Rev.C56(1997)2229",1997
Electronic,PC97,"Priv. comm. (""Anonym·, 1997). Not confirmed! ",...................................... D,"Priv.comm.(""Anonym·,1997).Notconfirmed!",1997
Electronic,Si98,"I.Sick, and D.Trautmann: Nucl. Phys., A637 (1998) 559 ",........................ D: re-anal ofx-sects.,"I.Sick,D.Trautmann",1998
Muonic,Wh49,J.A.Wheeler: Rev. Mod. Phys. 21 (1949) 133 ,......................................... Method suggested,J.A.Wheeler,1949
Muonic,Co53,"L.N.Cooper, and EM.Henley: Phys. Rev. 92 (1953) 801 ",........................ Method,"L.N.Cooper,EM.Henley",1953
Muonic,Fi53,"V.L.Fitch, and J.Rainwater: Phys. Rev. 92 (1953) 789 ","............................ Ti, Cu, Sb, Pb","V.L.Fitch,J.Rainwater",1953
Muonic,Wh53,J.A.Wheeler: Phys. Rev. 92 (1953) 812 ,.................................................. Method,J.A.Wheeler,1953
Muonic,Br62,"P.Brix, et al.: Phys. Letters, 1 (1962) 56 ",.................................................. Many; preliminary,"P.Brix,etal.",1962
Muonic,Fr62,"W.Frati, and J.Rainwater: Phys. Rev. 128 (1962) 2360 ",".......................... Ti, Fe, Cu, Zn,Tl, Pb, Bi","W.Frati,J.Rainwater",1962
Muonic,Jo62,"C.S.Johnson, E.P.Hincks, H.L.Anderson: Phys. Rev. 125(1962)2102 ",".... AI, K, Ca, Ti, Cr, Mn, Fe, Co, Ni, Cu, Zn","C.S.Johnson,E.P.Hincks,H.L.Anderson",1962
Muonic,An63,"H.L.Anderson, C.S.Johnson, E.P.Hincks: Phys. Rev. 130(1963)2468 ",".... Mg, Al, Si, P, S, Cl, Ca, Fe, Ni, Zn, As, Zr, Mo","H.L.Anderson,C.S.Johnson,E.P.Hincks",1963
Muonic,Bj64,"J.A.Bjorkland, et al.: Phys. Rev. 136 (1964) B 341 ",.................................. Ca,"J.A.Bjorkland,etal.",1964
Muonic,Eh64,"RD.Ehrlich, et al.: Phys. Rev. Lett. 13 (1964) 550 ",".................................. Th, U","RD.Ehrlich,etal.",1964
Muonic,Qu64,"D.Quitmann, et al.: Nuc/. Phys. 51 (1964) 609 ","........................................ S, K, Ca, Ti, Mn, Fe, Co, Ni, Cu, Zn, As, Mo","D.Quitmann,etal.",1964
Muonic,Ac65,"H.L.Acker, et al.: Phys. Letters, 14 (1965) 317 ","........................................ Au, Pb, Bi, W, U","H.L.Acker,etal.",1965
Muonic,Ba65,"G.Backenstoss, et al.: Nuc/. Phys. 62 (1965) 449 ","................................... Rh, Pd, Ag, Cd, In, Sn, Sb, Te, I, Cs, Ba, La, Ce, Pr, Pb, Bi","G.Backenstoss,etal.",1965
Muonic,Bj65,"J.A.Bjorkland, et al.: Nucl. Phys. 69 (1965) 161 ","...................................... Mg, Al, Ca, V, Fe, Cu, Ni, Zn","J.A.Bjorkland,etal.",1965
Muonic,Ch65,"C.Chasman, et al.: Phys. Rev. Lett. 14 (1965) 181 ",................................. Mo,"C.Chasman,etal.",1965
Muonic,Ac66,"H.L.Acker, et al.: Nuc/. Phys. 87 (1966) 1 ","................................................ Cl, Ca, Fe, Sn, Sb, Te, I, As, Ba, La, Ce, Pr, Nd, Au, Hg, Tl, Pb, Bi","H.L.Acker,etal.",1966
Muonic,An66,"H.L.Anderson, et al.: Phys. Rev. Lett. 16 (1966) 434 ",............................. Pb,"H.L.Anderson,etal.",1966
Muonic,Ba66,"TT.Bardin, et al.: Phys. Rev. Lett. 16 (1966) 429 ",................................... Bi,"TT.Bardin,etal.",1966
Muonic,Ba66a,TT.Bardin et al: Prog. Rep. Jan. 1 (1966) GEN-72; ONR-666(72) (From Wu69 and En74),......... Ti,TT.Bardinetal,1966
Muonic,Ba66b,"TT.Bardin, et al.: Phys. Rev. Lett. 16 (1966) 718 ","................................... Sn, Nd, W","TT.Bardin,etal.",1966
Muonic,Eh66,"RD.Ehrlich, et al.: Phys. Rev. Lett. 16 (1966) 425 ",.................................. Bi,"RD.Ehrlich,etal.",1966
Muonic,Eh66a,"RD.Ehrlich, et al.: Phys. Letters, 23 (1966) 468 ",..................................... Pb,"RD.Ehrlich,etal.",1966
Muonic,Je66,"D.A.Jenkins, et al.: Phys. Rev. Lett. 17 (1966) 1 ","..................................... Li, Be, B, C, N, 0, F, Na, Mg","D.A.Jenkins,etal.",1966
Muonic,Ba67,"C.G.Backenstoss, et al.: Phys. Letters, 25B (1967) 547 ","......................... B, C, N, 0, F, Na, Mg, Al, Si, P, S, Cl","C.G.Backenstoss,etal.",1967
Muonic,Ba67a,"T.T.Bardin, et al.: Phys. Rev. 160 (1967) 1043 ",....................................... Bi,"T.T.Bardin,etal.",1967
Muonic,Be67,"S.Bemow, et al.: Phys. Rev. Lett. 18 (1967) 787 ",..................................... Sm,"S.Bemow,etal.",1967
Muonic,Bu67,"Yu.T.Budyashov, et al.: Yad. Fiz. 5 (1967) 134 ","....................................... Ar, S, Cl, K, Ca, Cr","Yu.T.Budyashov,etal.",1967
Muonic,El67,"L.RB.Elton: Landolt-Bornstein, Gruppe I.: Kernphysik und Kerntechnik, Band 2: Kemradien; Springer, Berlin (1967) pp.1-20 ",..................... Many; compilation,L.RB.Elton,1967
Muonic,Su67,A.Suzuki: Phys. Rev. Lett. 19 (1967) 1005 ,"............................................. Mg, Si, S, Ca",A.Suzuki,1967
Muonic,We67,"R.J.Wetmore, et al.: Phys. Rev. Lett. 19 (1967) 1003 ",............................. He,"R.J.Wetmore,etal.",1967
Muonic,Wr67,"S.A.De Wit, et al.: Nucl. Phys. 87 (1967)657 ","........................................... Sm, Eu, Tb, Ho, Hf, Ta, W, Os, Ir, Th, U, Pu","S.A.DeWit,etal.",1967
Muonic,Be68,"S.Bernow, et al.: Phys. Rev. Lett. 21 (1968) 457 ","..................................... Nd, Sm, Gd, Er, W","S.Bernow,etal.",1968
Muonic,Ca68,"RA.Carrigan.Jr., et al.: Phys. Rev. Lett. 20 (1968) 874 ",.......................... Eu,"RA.Carrigan.Jr.,etal.",1968
Muonic,Ca68a,"R.A.Carrigan,Jr., et al.: Phys. Letters, 278 (1968) 622 ",........................... Ag,"R.A.Carrigan,Jr.,etal.",1968
Muonic,Eh68,RD.Ehrlich: Phys. Rev. 173 (1968) 1088 ,"................................................ K, Ca, Fe, Ni, Cu, Sr, Zr, Sn",RD.Ehrlich,1968
Muonic,Ha68,"R.J Harris, et al.: Phys. Rev. Lett. 20 (1968) 505 ",".................................... Li, Be, B, C","R.JHarris,etal.",1968
Muonic,Po68,R.J.Powers: Phys. Rev. 169 (1968) 1 ,"...................................................... Pb, Bi",R.J.Powers,1968
Muonic,Su68,"M.N.Suzuki: Thesis, Carnegie-Mellon Univ. (1968) unp. (from En74) ",..... Lu,M.N.Suzuki,1968
Muonic,An69,"H.L.Anderson, etal.: Phys. Rev. 187 (1969) 1565 ",.................................. Pb,"H.L.Anderson,etal.",1969
Muonic,Co69,"RE.Cati, etal.: Phys. Rev. 179 (1969) 1134 ","........................................... Th, U","RE.Cati,etal.",1969
Muonic,Fo69,"KW.Ford, and J.G.Wills: Phys. Rev. 185 (1969) 1429 ",............................ Theory,"KW.Ford,J.G.Wills",1969
Muonic,Le69,"W.Y.Lee, et al.: Phys. Rev. Lett. 23 (1969) 648 ","....................................... In, Cs, Pr","W.Y.Lee,etal.",1969
Muonic,MK69,R.J.McKee: Phys. Rev. 180 (1969) 1139 ,"................................................. Th, U",R.J.McKee,1969
Muonic,Wu69,C.S.Wu and L.Wilets: Ann. Rev. Nuc/. Sci. 19 (1969) 546 ,...................... Review,C.S.WuL.Wilets,1969
Muonic,Be70,"A.Bertin, et al.: Phys. Letters, 558 (1970) 411 ",........................................ He,"A.Bertin,etal.",1970
Muonic,Hi70,"D.Hitlin, et al.: Phys. Rev, C1 (1970) 1184 ",".............................................. Nd, Sm, Dy, Er, W","D.Hitlin,etal.",1970
Muonic,Je70,"D.A.Jenkins, et al.: Phys. Letters, 328 (1970) 267 ",.................................. Ce,"D.A.Jenkins,etal.",1970
Muonic,Ke70,"D.Kessler, et al.: Can. J. Phys. 48 (1970) 3029 ",....................................... Y,"D.Kessler,etal.",1970
Muonic,Ma70,"E.RMacagno, et al.: Phys. Rev. C1 (1970) 1202 ",".................................... Ca, Cr, Cu, Mo, Sn, Nd","E.RMacagno,etal.",1970
Muonic,Ba71,"G.Backenstoss, et al.: Phys. Letters, 36B (1971) 422 ","............................. Ne, Ar","G.Backenstoss,etal.",1971
Muonic,Ba71a,"H.Backe: Z. Physik, 241 (1971) 435 ","........................................................ W, Os, Bi",H.Backe,1971
Muonic,Bv71,T.Bohringer: Trav. dip/. ETH Zurich (1971) unpubl. (From En74) ,........... Fe,T.Bohringer,1971
Muonic,Di71,"M.S.Dixit, etal.: Phys. Rev. Lett. 27 (1971) 878 ","...................................... Ca, Ti, Fe, Sr, Ag, Cd,Sn,Ba,Pb","M.S.Dixit,etal.",1971
Muonic,Je71,"D.A.Jenkins, et al.: Nucl. Phys. A175 (1971) 73 ",...................................... Pb,"D.A.Jenkins,etal.",1971
Muonic,Ka71,"J.W.Kast, et al.: Nucl Phys. A169 (1971) 62 ","........................................... Cd, In, Sn, Te, I","J.W.Kast,etal.",1971
Muonic,Ki71,Y.N.Kim: Mesic atoms and nuclear structure. North-Holland P.Co.(1971) ,Review,Y.N.Kim,1971
Muonic,Pl71,"A.Placci, et al.: Nuovo Cimento 1A (1971) 445 ",....................................... He,"A.Placci,etal.",1971
Muonic,Ba72,"H.Backe, et al.: Nuc/. Phys. A189 (1972) 472 ",......................................... Tl,"H.Backe,etal.",1972
Muonic,Ki72,"Y.N.Kim, and M.Khan: Phys. Letters, 408 (1972) 217 ",............................ Pb (theory),"Y.N.Kim,M.Khan",1972
Muonic,Ma72,"P.Martin: Thesis, William and Mary College, WM-38-72 (from En74) ",..... Ba,P.Martin,
Muonic,Po72,"H.P.Povel: Thesis, Karlsruhe, KFK 1602 (1972) to be publ. (from En74)", Nb,H.P.Povel,1602
Muonic,Wa72,"H.K.Walter, etal.: Phys. Letters, 408 (1972) 197 ",".................................... Hg, Tl","H.K.Walter,etal.",1972
Muonic,Ad73,"D.T.Adler: Thesis, Carnegie-Me/Ion Univ. (1973) (from En74) ",................ Yb,D.T.Adler,1973
Muonic,De73,"E.Deci: Thesis, State Univ. NY at Binghampton (1973) unp. (from En74)", Tm,E.Deci,1973
Muonic,Fo73,"KW.Ford, and G.A.Rinker: Phys. Rev. C7 (1973) 1206 ",.......................... Pb (Re-anal.),"KW.Ford,G.A.Rinker",1973
Muonic,Pf73,H.J.Pfeiffer et al: Proc. Int. Conf. Nuc/. Phys. (1973) Munich Vol.1 p.313 .Ar,,H.J.Pfeifferetal,1973
Muonic,Ro73,"B.Robert-Tissot, et al.: He/v. Phys. Acta, 46 (1973) 51 ",........................... Au,"B.Robert-Tissot,etal.",1973
Muonic,Ze73,"A.Zehnder: Thesis, ETH Zurich (1973) to be publ. (from En74) ",.............. Yb,A.Zehnder,1973
Muonic,Ba74,"G.Backenstoss, et al.: Nuc/. Phys. A232 (1974) 519 ",............................... He,"G.Backenstoss,etal.",1974
Muonic,Da74,"H.Daniel, et al.: Phys. Letters, 488 (1974) 109 ",....................................... Ar,"H.Daniel,etal.",1974
Muonic,Du74,"T.Dubler,etal.:Nuc/.Phys.A219(1974)29 ","........................................... C, N, 0","T.Dubler,etal.",1974
Muonic,Eg74,"T.von Egidy, and H.P.Povel: Nucl. Phys. A232 (1974) 511 ","..................... C, 0","T.vonEgidy,H.P.Povel",1974
